topicId,words..
1,time good theodore kills told wife point suicide wounded law frederick turns king evil lover
2,mother son young marquis find la kidnapped caroline england raymond title ill political adeline sisters
3,castle love romance daughter villain falls inquisition huberto leopold isabella poison find stabs dungeon principal
4,man story family tale uncle put hand life years manuscript things lady order abbess earlier
5,wife mother count child time die arrives convent friend friends raised elizabeth called marries bad
6,matilda sir home brother claudio imprisoned dying charles body woman laura paulina husband elinor living
7,girl dead death murder night prince kill wedding captured discovered selina falkland rape head attracted
8,lord edward lady earl woman maria appears black end marrying marries real trouble place married
9,father dies marry st back marriage finds finally emily long leaves money takes sees end
10,makes dies finds named parents baby day home house child takes life leaving persuades blood
11,father ghost discovers tells man young escape convent sister monk discover servant found wishes murdered
12,marry family sister marries son marriage agnes mother abbey emma named home children ferdinand cousin
13,mrs mr secret sister father lorenzo house meets miss killed loves di gaming care jacintha
14,de brother henry son mary married mother boy sir daughter father madeline jane love haunted
15,love friend julia baron begins husband make william happy died louisa beautiful hopes anna ricardo
