topicId,words..
1,laura selina prince leads husband writes pursues ilford elvira picture zeluco french passion carlostein twins
2,place plot times lady philip scott magic war wizard women rescued involves friar encounters number
3,guardian story accuses heart sister chest executed clothing charge errors irish complications signs assassin affairs
4,ferdinand louisa ernestus named renaldo seduction marries wounded illness make nursing berchtold rhodophil catch virtuous
5,mrs mr miss marry rosalind lord living attracted night marriage meredith ormando osmond kidnaps set
6,villain rescues marriage kidnapped rosalina end hero vicious attacks promises manfrone career eleanor montalto commit
7,castruccio cronstadt real euthanasia life bertha salathiel storm wars valperga wandering inquisition eager conspiracy ship
8,henry father jane hector adventures amelia major reader dufresne case monckton maria fitzallan notion veiled
9,margaret frankenstein monster austin fitzwalter leaving elder st hoffman walton vice cave suitable wardine infant
10,frederick captain married howard loved telling fever proposed upright shipwreck ellenor include domestic deborah thinks
11,child loves dies bad die girl place poisons wicked montalva avoid wishes effects separate villainous
12,brother thinks inherit rosa marries century important arrested saves trial carried son francisco barozzi secretly
13,caroline makes named alhamet lucy ethelia sisters died appearance ozembo throw wild suddenly henrietta sunderland
14,king richard hubert isabel historical enemy knight ii siege voice won world clear belongs disappeared
15,mother wife secret live dying money note grandmother house reluctantly duel warns revelation class robbers
16,son alphonso discovers boy proves return bloody montavole don missing gonsalvo mara cut miranda reasons
17,bed child lives lover led peasant carries attacked una wounds servants cavern leolyn daemon ancient
18,emily aunt social volume avondel elope godfrey move interesting friend nephew chapter corpses venice valancourt
19,charles young george robert men woodvile murdered martin gil wringham refuge colwan awakens jr lumm
20,save god sends bride time vengeance hippolita condition marian italian control home beautiful behavior belgrave
21,marry young family love obliged stranger household figure apparently order heard clarentine heart intentions past
22,rosalviva wolfstein body chief golfieri demon leontini ginotti oakendale mistress megalena escaped fears suicide appears
23,father discovers monk murdered marry romance rape ruined good forced dagger attempt dungeon kill attack
24,lionel adrian angelo gabrielle finally children friend england perdita raymond lover page free plague greece
25,monastery manfredi interest fernandez ambrosio du murderer murders disguised previously beautiful roldan adelais ignatius side
26,murder part persuaded earlier blood principal arrival crimes romance letters red large bruce pass raises
27,died begins friends son death giving guilt birth left juliana imprisonment day door alonza orphaned
28,edward uncle helen business made walk belmour ruined paternal instance delvalley anastasia appalled augusta sophia
29,man mysterious tells raised takes story things imprisoned white german occult information clara herman faints
30,mary fleetwood learns kenrick osbert travels elder wales turned gifford continent important macneil sound alleyn
31,lady money gertrude uncle graham london finds ormsby boy life dying upset country relationship visit
32,la adeline louis marquis character motte montalt son prison brother obliged loses circumstances archdale madame
33,sigismorn morcar imogen night king etheldart adelbert ulthona protect number certaldo bosom tower etheline unna
34,friend man father marries years kind boy believes world accidentally debt likes nice stay married
35,de raby priory revealed identity cottage admits order villainy period lead queen point false allanrod
36,miniature point good increasingly margiana thought ethelred half hear love aurelia north genevieve princess belford
37,di viola claudio killed valeria brought roberto pilgrim poisoned marry kidnapped conte valdetti julio lodovico
38,matilda uncle elinor repents verezzi unscrupulous queen wolfenbach leicester recess royal zastrozzi fever papers explains
39,finds takes baby years offers makes home black begins earlier duel local morning child guilty
40,father helena sisters althea marchmont music shock youngest angerville eugenius flee decline prison principal manor
41,home parents companion cousin family lives foster azelia fitz owen abduction devoted lovel born future
42,love made recovers missing including awkward planning fight eldred marries feeling wanderings mysteriously nature revenge
43,family stay son peggy colonel duncan briefly nocturnal dunamore countess subsequently born reasons earlier america
44,marry decides lorrimond sword margaret virtue allandale permits mora rosilda seer duncannon vows island constance
45,huberto inquisition duca monastery gondez night valenza english ozimo cardinal rome thinking monk seduce plot
46,henri claudio camilla julian body page begin favorite bring human real adds arnaud brothers cave
47,ellen children husband valentine proposes ulric brings charity joins execution son means nurse fell miriam
48,st good house leon cazire elmer olivia ariel fribourg food news hands lindorf principles usurper
49,theodore isabella frank forest manfred eliza robber rumors koenigsmark wheeler madhouse john helmet giant rosenburg
50,agnes abbey family rosaline alfred reunited constantine escaped villars adolphus gondemar determined ollifont villainy london
51,emma edwin anna corpse fanny wilson clifton agnes marauder william london marriage whitmore editha godwin
52,meets clergyman gaming raised maisuna secrets poor misunderstanding marriage involved father inheritance carroll likes jefferson
53,victoria bandits caesario bandit abdallah zacherelli give vicenza naples release twin alphonsine deal passionate room
54,blanche frankheim girl osbright makes tales property enters widow brooks wolf victims jocelyn orrenberg narrator
55,dubois letter run adelaide find father pregnant rhubarbin president italy intends estate death board body
56,elizabeth discovered hears falls ship permitted donat ida falkner neighborhood emmeline urania lucretia rights plot
57,engaged donald specter roderic kidnapping die murchardus bit appears stabs astolpho writing plans catherine prophecy
58,elinor clement darrell feels jennet augusta clifford twenty end mistress occasion explains vernon brothers begins
59,family uncle alphonsus spirit disappeared receives midnight made lovers grows lauretta informed troubles confusion dick
60,falkland williams maddalena murder fact buried marcello tyrrel jealous rival stanley turn ubaldo youth conversation
61,castle wedding find friend arrives haunted wishes daughter poison romance countess attracted suddenly found prisoner
62,fire hand rescue decides vathek drugs subterranean boys palace nouronihar giaour wished manages great arrives
63,head ricardo nobleman priest left found ring catholic agatha calini experience hunting parentage bernardo roman
64,time woman named end child calls told apparently foster takes cruel supernatural living day scotland
65,mother marquis duke marchioness vereza love rosabella rosalva dream mortaigne fancies machinations doge party resolved
66,count wife kills servant turns fact warning wicked specters mad imprisoned saved lunacy chooses shoot
67,dies back life grave sees home moves loves dreams ultimately finds escapes ruins force villain
68,mother good story locked uncle difficulties attempts tale dead libertine happily half seduced fortune domestic
69,sister brother woman married marriage turns law die infant hermit meet relationships tale mother couple
70,ghost duke tells portrait local dinner ida heiress drops fortune enemy sends seraphina curse hour
71,adelaide son fall dies marry rosette mistress younger believed problem effect lunatic suspects leave delaune
72,father madeline suicide marry commits gothic roseline voice walter young forgives alembert stop live loves
73,friends back society ghosts happy blood appears ghost company explained discovery incidents spectacular sensibility accidentally
74,evil fiormonda ada roselma kabkarra reis months hell church day sacrifice wedding forever condulmar chance
75,leopold supposed arthur frederic adeline makes adolphus villains abbot ortano ethelwina nuns asks burn coffin
76,orlando girl night daughter don theodosius osmund died leonora earlier everard deathbed age boys assassination
77,sir raymond ghost eleonora hildebrand fact acquaintance informed protection valentine sigismund unknown subsequently netley brother
78,finally long marriage lost discovered brought making imprisonment great narrative captures exceedingly open maid manages
79,kill title men wounded vivaldi marry ellena secretly house widow interest blue hunt lafrance schedoni
80,lorenzo sinister girl man innocent dies ruthven aubrey cornelia don black raphael delacour attached threatens
81,sister jacintha finds castle tower egbert decourcy greville reveal hand match endermay rumor gwytherin town
82,julia baron army albertina cold stabs coming scene husband loves fond virtuous growing apollonia wiemar
83,william family home hopes alfred promised account happy frightening received male proposes barn degree dangerous
84,father discover marries apparently wife girls notes childbirth arrives back engagement sort romantic happy afterward
85,trouble court takes political grief england characters previous shipwrecked essex willoughby make feel lot continues
86,manuscript leonard stranger blondeville military clarence aigline day runs woodreeve lolotte origins adhemar stepfather folville
87,love dies leaves kill put make refuses falls leave beautiful death finds things care unable
88,persuades thomas history bad read modern glenarvon marney calantha zittaw ireland complicated philosophy college birth
89,maria santa hersilia prince conrad sanguedoni rudolph high parma knights moral hortensia wears rinaldo sleep
90,daughter paulina marchese beautiful antonia seduces heroine margaretta city landgrave wallace stabbing safe maximilian masque
91,eugene love aunt bones find children persuades grace rose returns identifies reader confused mordaunt accused
92,rimauldo hag meeting braunch la constanza cesario badajos invited estates bertha watching talking del alwena
93,earl lord real time son daughter marrying edmund mother kidnapped estate general ends suspicions ravenspur
94,dead death alive killed servant female captured found room left town disappears route fact mysteries
95,girl called son complicated carlos confesses secret elmira events asks women shot ng full francisca
96,lord heir amanda mortimer true belgrave result courtenaye algernon oscar isabelle marrying adela cherbury toulouse
97,husband late charlotte school reginald baroness ormond edgar feels care running maurice godolphins winifred warbeck
98,brother house falls young sees leaving home ill hears window death supposes brothers pair stay
99,story tale life people end melmoth told john manuscript wanderer insane steward early bargain left
100,convent marry escape daughter nun abbess religious romance helps laurette hired battle julie ostensibly beware
